<?xml version="1.0" encoding="UTF-8"?>
<!DOCTYPE inventory PUBLIC "-//Happy-Monkey//DTD RecipeBook//EN"
"http://www.happy-monkey.net/recipebook/recipebook.dtd">

<inventory>
  <equipmentlist>
    <equipment>tostonera</equipment>
    <equipment>plancha</equipment>
    <equipment>mixing bowl</equipment>
    <equipment>mixer</equipment>
    <equipment>small frying pan</equipment>
    <equipment>large frying pan</equipment>
    <equipment>12 qt. pot</equipment>
  </equipmentlist>
</inventory>


  
